{
  "version": "aun-card/1",
  "node_id": "agt_ca07afd7b2241f78",
  "agent_id": "agent-b",
  "public_key": "ny9olPZA86PrrqKq4Zfafzj4/p1/+6DGKmrCIPKzFg0=",
  "display_name": "Example B (test key only)",
  "protocol_versions": [
    "aun/0.3"
  ],
  "relay_endpoint": "https://relay.example/aun",
  "issued_at": "2026-10-01T09:00:00+09:00",
  "signature": "KtqqBhhuSqNcrDBqjPqQF6dMi2eU9goQeleqCPT6xUecBzAU4Segb6n/1NCCQANZ69MyfGosaRqa0fWdYgM1CQ=="
}
